{
  "apiVersion": 1,
  "id": "org.community.selfhosted",
  "name": "My self-hosted music",
  "version": "1.0.0",
  "capabilities": [
    "catalog.read",
    "stream.play",
    "party.session"
  ],
  "origins": [
    "https://music.example.com"
  ],
  "provider": {
    "catalogUrl": "https://music.example.com/v1/catalog"
  },
  "party": {
    "url": "https://music.example.com/v1/party"
  }
}
